{
  "schema_version": "aimd.validator.output.v1.5",
  "validator": {
    "kind": "semantic",
    "version": "1.1.0",
    "run_id": "sem-example-001",
    "timestamp": "2026-03-31T10:05:00+09:00"
  },
  "document": {
    "path": "examples/aiworks-platform.aimd",
    "aimd_version": "1.5",
    "doc_id": "aiworks-platform",
    "revision": 8,
    "mode": "c",
    "source_type": "aimd"
  },
  "result": "pass_with_warnings",
  "scores": {
    "overall": 88,
    "fidelity": 94,
    "consistency": 91,
    "state_discipline": 78,
    "referential_integrity": 82,
    "semantic_total": 88
  },
  "issues": [
    {
      "severity": "warning",
      "code": "sem.ref.dangling_id",
      "block": "state",
      "line_id": "v3",
      "message": "referenced ID exists but might be deprecated or outside current scope",
      "evidence": [
        "v3: db_migration_completed ref(r1, legacy_r5)"
      ],
      "repair_hint": "Check if legacy_r5 is intentionally removed; if so, update ref() to use current rule IDs"
    },
    {
      "severity": "warning",
      "code": "sem.date.future_date",
      "block": "state",
      "line_id": "v5",
      "message": "completion date matches a future date relative to system clock",
      "evidence": [
        "v5: feature_deployed @2026-12-31"
      ],
      "repair_hint": "Verify if this is an estimated completion date; move to 'o' if not yet completed"
    }
  ],
  "summary": {
    "message": "Semantic validation passed with v1.5 warnings. Verifiable references and temporal metadata are present but contain minor inconsistencies.",
    "highlights": [
      "verifiable link density is high",
      "referential logic generally sound",
      "temporal metadata requires manual check"
    ],
    "critical_issue_count": 0,
    "warning_count": 2,
    "info_count": 0
  },
  "repair_hints": [
    {
      "target": "state.v3",
      "action": "cleanup dangling reference to legacy_r5",
      "reason": "maintains referential integrity"
    },
    {
      "target": "state.v5",
      "action": "rectify future date metadata",
      "reason": "ensures temporal evidence validity"
    }
  ],
  "projections": {
    "fe": {
      "line_count": 12,
      "token_count": 182,
      "result": "pass"
    },
    "be": {
      "line_count": 18,
      "token_count": 265,
      "result": "pass"
    }
  }
}
