{
  "schema_version": "aimd.validator.output.v1.5",
  "validator": {
    "kind": "syntax",
    "version": "1.1.0",
    "run_id": "syn-example-001",
    "timestamp": "2026-03-31T10:00:00+09:00"
  },
  "document": {
    "path": "examples/payment-retry.aimd",
    "aimd_version": "1.5",
    "doc_id": "payment-retry",
    "revision": 4,
    "mode": "c",
    "source_type": "aimd"
  },
  "result": "pass",
  "scores": {
    "overall": 98,
    "structure": 100,
    "referential_integrity": 100
  },
  "issues": [],
  "summary": {
    "message": "Syntax validation passed for AIMD v1.5. Required front matter, core blocks, and canonical line formats (including ref() and @date) are valid.",
    "highlights": [
      "front matter strictly valid",
      "core block sequences compliant",
      "referential integrity verified inside document"
    ],
    "critical_issue_count": 0,
    "warning_count": 0,
    "info_count": 0
  },
  "repair_hints": []
}
